{
  "schema_version": "1.0.0",
  "experiment_id": "exp_0000",
  "slug": "harness-smoke",
  "owner": "Phurinat Polasa",
  "task_id": "TASK-0003",
  "parent_experiment_id": null,
  "research_question": "Does the repository Harness validate its governance, contracts, schemas, fixtures, and temporal audit without training a model?",
  "hypothesis": "The complete Tier 0 Harness smoke command will pass deterministically using only repository files and synthetic patient-journey fixtures.",
  "decision_informed": "Whether the repository is ready for the first human-reviewed commit and Project Idea work",
  "status": "completed",
  "run_tier": 0,
  "created_at": "2026-08-11T04:00:00+07:00",
  "code": {
    "revision": "pre-initial-commit",
    "dirty": true,
    "diff_artifact": null,
    "config_hash": "harness-smoke-v1"
  },
  "model": {
    "name": "no-model-harness-validation",
    "version": "1.0.0",
    "parameter_count": 1,
    "initialization": "not_applicable",
    "license": "not_applicable"
  },
  "data": {
    "dataset_version": "synthetic-fixture-v1",
    "split_version": "synthetic-expert-test-v1",
    "split_checksum": "fixture-valid-v1",
    "preprocessing_version": "none-v1",
    "temporal_audit_id": "harness-temporal-audit-v1",
    "classification": "SYNTHETIC",
    "license_status": "cleared"
  },
  "training": {
    "seed": 0,
    "precision": "not_applicable",
    "optimizer": "not_applicable",
    "scheduler": "not_applicable",
    "max_steps": 0,
    "max_tokens": 0,
    "batch_size": 1,
    "gradient_accumulation": 1,
    "checkpoint_policy": "No checkpoints are created by the Harness smoke test"
  },
  "graph": {
    "mode": "not_applicable",
    "schema_version": "not_applicable-v1",
    "operator_library_version": "not_applicable-v1",
    "max_nodes": 0,
    "max_depth": 0,
    "routing_objectives": []
  },
  "resources": {
    "devices": "CPU",
    "gpu_count": 0,
    "estimated_minutes": 2,
    "estimated_gpu_hours": 0,
    "estimated_cost_usd": 0,
    "estimated_storage_gb": 0.01
  },
  "comparisons": {
    "baseline_experiment_ids": [],
    "fixed_factors": ["repository content", "Python standard library", "synthetic fixture"],
    "changed_factors": ["Harness validation result"],
    "fairness_notes": "This is a deterministic repository validation and not a model comparison"
  },
  "evaluation": {
    "evaluator_version": "verify-harness-v1",
    "primary_metrics": ["all_required_checks_pass"],
    "secondary_metrics": ["schema_count", "agent_count", "skill_count"],
    "statistics_plan": "Report deterministic pass or fail and the exact failing checks; statistical inference is not applicable",
    "exclusion_rules": ["No failed check may be excluded from the final smoke verdict"],
    "final_test_access": "not_applicable"
  },
  "stop_rules": ["Stop on the first command failure while preserving complete verifier output"],
  "artifacts": {
    "root": "artifacts/experiments/exp_0000",
    "logs": "artifacts/experiments/exp_0000/smoke.log",
    "checkpoints": "artifacts/experiments/exp_0000/no-checkpoints",
    "predictions": "artifacts/experiments/exp_0000/temporal-audit.json",
    "evaluation_record": "artifacts/experiments/exp_0000/verification-result.json",
    "retention": "Retain verifier output with the initial repository review evidence"
  },
  "approvals": {
    "required": false,
    "approval_ids": []
  },
  "risks": ["RISK-0008"],
  "result": {
    "started_at": "2026-08-11T04:15:00+07:00",
    "completed_at": "2026-08-11T04:15:01+07:00",
    "terminal_status": "completed",
    "command": "bash scripts/run_smoke_test.sh",
    "exit_code": 0,
    "actual_resources": {
      "devices": "CPU",
      "gpu_count": 0,
      "gpu_hours": 0,
      "cost_usd": 0
    },
    "metrics": {
      "all_required_checks_pass": true,
      "harness_checks": 199,
      "agent_count": 12,
      "skill_count": 11,
      "patient_journey_files_audited": 1
    },
    "temporal_audit": {
      "decision_time": "2026-01-01T09:15:00Z",
      "eligible_event_ids": ["ev-001", "ev-002"],
      "future_event_ids_excluded": ["ev-003"],
      "verdict": "PASS"
    },
    "evidence": [
      "scripts/verify_harness.py",
      "scripts/validate_manifest.py",
      "scripts/temporal_leakage_audit.py",
      "tests/fixtures/patient_journey/valid.json"
    ]
  }
}
