{
  "schema_version": "1.0.0",
  "experiment_id": "exp_0001",
  "slug": "frontdoor-synthetic-evaluation",
  "owner": "Thanrada Tungweerapornpong",
  "task_id": "TASK-0025",
  "parent_experiment_id": null,
  "research_question": "Under a frozen synthetic case set, does the Clinical Front Door hold its safety invariants \u2014 no under-triage below the declared floor, human review always required, no future evidence reaching the model, and safe failure when the provider is unavailable?",
  "hypothesis": "With a deterministic provider, the Front Door reaches at least each case's declared minimum urgency, requires human review on every path, admits no evidence dated after the decision time, and returns FAILED_SAFE on provider failure.",
  "decision_informed": "Whether the Innovation track's safety behaviour is sound enough to build on, and what escalation rate the case-adaptive model must improve upon",
  "status": "completed",
  "run_tier": 0,
  "created_at": "2026-08-30T23:00:00+07:00",
  "code": {
    "revision": "see evaluation record code_revision",
    "dirty": true,
    "diff_artifact": null,
    "config_hash": "frontdoor-eval-v1"
  },
  "model": {
    "name": "mock-provider",
    "version": "mock-v1",
    "parameter_count": 1,
    "initialization": "not_applicable",
    "license": "not_applicable"
  },
  "data": {
    "dataset_version": "frozen-synthetic-cases-1.0.0",
    "split_version": "synthetic-expert_test-1.0.0",
    "split_checksum": "frozen-cases-v1",
    "preprocessing_version": "none-v1",
    "temporal_audit_id": "frontdoor-eval-temporal-v1",
    "classification": "SYNTHETIC",
    "license_status": "cleared"
  },
  "training": {
    "seed": 0,
    "precision": "not_applicable",
    "optimizer": "not_applicable",
    "scheduler": "not_applicable",
    "max_steps": 0,
    "max_tokens": 0,
    "batch_size": 1,
    "gradient_accumulation": 1,
    "checkpoint_policy": "No checkpoints; this is an evaluation of deterministic behaviour"
  },
  "graph": {
    "mode": "not_applicable",
    "schema_version": "1.0.0",
    "operator_library_version": "not_applicable-v1",
    "max_nodes": 0,
    "max_depth": 0,
    "routing_objectives": []
  },
  "resources": {
    "devices": "CPU",
    "gpu_count": 0,
    "estimated_minutes": 1,
    "estimated_gpu_hours": 0,
    "estimated_cost_usd": 0,
    "estimated_storage_gb": 0.01
  },
  "comparisons": {
    "baseline_experiment_ids": [],
    "fixed_factors": [
      "frozen case set",
      "decision time per case",
      "contract version",
      "safety policy version"
    ],
    "changed_factors": [
      "provider adapter"
    ],
    "fairness_notes": "Mock and baseline adapters see identical cases at identical decision times through the same gateway. This compares adapters under one contract; it is not a comparison of clinical capability, and neither adapter is a clinical model."
  },
  "evaluation": {
    "evaluator_version": "frontdoor-eval-v1",
    "primary_metrics": [
      "under_triage_rate",
      "critical_case_sensitivity"
    ],
    "secondary_metrics": [
      "escalation_rate",
      "abstention_rate",
      "safe_failure_rate",
      "human_review_required_rate",
      "temporal_violation_rate",
      "override_rate"
    ],
    "statistics_plan": "Descriptive rates over a frozen synthetic set. No hypothesis test, no confidence interval and no pass/fail threshold: the sample is small, author-constructed and has no clinical reference standard.",
    "exclusion_rules": [
      "No case may be excluded after its result is seen"
    ],
    "final_test_access": "not_applicable"
  },
  "stop_rules": [
    "Stop and invalidate the run if temporal_violation_rate is above zero or human_review_required_rate is below one"
  ],
  "artifacts": {
    "root": "artifacts/experiments/exp_0001",
    "logs": "artifacts/experiments/exp_0001/eval.log",
    "checkpoints": "artifacts/experiments/exp_0001/no-checkpoints",
    "predictions": "artifacts/experiments/exp_0001/case-results.json",
    "evaluation_record": "artifacts/experiments/exp_0001/evaluation-record.json",
    "retention": "Retain with the Proposal Report evidence"
  },
  "approvals": {
    "required": false,
    "approval_ids": []
  },
  "risks": [
    "RISK-0007"
  ],
  "result": {
    "started_at": "2026-08-30T23:00:00+07:00",
    "completed_at": "2026-08-30T23:00:02+07:00",
    "terminal_status": "completed",
    "command": "python3 -m innovation.evaluation",
    "exit_code": 0,
    "actual_resources": {
      "devices": "CPU",
      "gpu_count": 0,
      "gpu_hours": 0,
      "cost_usd": 0
    },
    "metrics": {
      "cases": 12,
      "under_triage_rate": 0.0,
      "critical_case_sensitivity": 1.0,
      "escalation_rate": 0.8333,
      "abstention_rate": 0.1667,
      "safe_failure_rate": 1.0,
      "human_review_required_rate": 1.0,
      "temporal_violation_rate": 0.0
    },
    "temporal_audit": {
      "decision_time": "per case",
      "eligible_event_ids": [
        "per case"
      ],
      "future_event_ids_excluded": [
        "case-0010 ev-003"
      ],
      "verdict": "PASS"
    },
    "evidence": [
      "tests/fixtures/cases/",
      "innovation/evaluation/",
      "project_state/evaluations.json"
    ]
  }
}
