{
  "schema_version": "1.0.0",
  "experiment_id": "exp_0002",
  "slug": "medx-workflow-comparison",
  "owner": "Thanrada Tungweerapornpong",
  "task_id": "TASK-0025",
  "parent_experiment_id": null,
  "research_question": "Do typed case-adaptive workflows preserve gateway invariants and replay under matched providers and call caps?",
  "hypothesis": "All workflows preserve mandatory gateway invariants; adaptive routing changes executed operators with evidence availability.",
  "decision_informed": "Engineering readiness of MedX workflow integration, not clinical efficacy",
  "status": "planned",
  "run_tier": 0,
  "created_at": "2026-09-22T00:00:00+07:00",
  "code": {
    "revision": "b8e53e7a21366525350cdb19a6c9782568496fce",
    "dirty": true,
    "diff_artifact": null,
    "config_hash": "medx-workflow-v1"
  },
  "model": {
    "name": "mock-provider",
    "version": "mock-v1",
    "parameter_count": 1,
    "initialization": "not_applicable",
    "license": "not_applicable"
  },
  "data": {
    "dataset_version": "medx-synthetic-patients-v1",
    "split_version": "patient-before-snapshot-v1",
    "split_checksum": "deterministic-medx-20-patients-12-4-4",
    "preprocessing_version": "strict-availability-v1",
    "temporal_audit_id": "test_medx_workflow",
    "classification": "SYNTHETIC",
    "license_status": "cleared"
  },
  "training": {
    "seed": 0,
    "precision": "not_applicable",
    "optimizer": "not_applicable",
    "scheduler": "not_applicable",
    "max_steps": 0,
    "max_tokens": 0,
    "batch_size": 1,
    "gradient_accumulation": 1,
    "checkpoint_policy": "No checkpoints; this is an evaluation of deterministic behaviour"
  },
  "graph": {
    "mode": "not_applicable",
    "schema_version": "1.0.0",
    "operator_library_version": "not_applicable-v1",
    "max_nodes": 0,
    "max_depth": 0,
    "routing_objectives": []
  },
  "resources": {
    "devices": "CPU",
    "gpu_count": 0,
    "estimated_minutes": 1,
    "estimated_gpu_hours": 0,
    "estimated_cost_usd": 0,
    "estimated_storage_gb": 0.01
  },
  "comparisons": {
    "baseline_experiment_ids": [],
    "fixed_factors": [
      "provider and model",
      "patient splits",
      "decision snapshots",
      "8 tools per run; 30 per case; 20 turns",
      "mandatory safety gateway"
    ],
    "changed_factors": [
      "workflow graph operators"
    ],
    "fairness_notes": "No training. One draft model call per completed run. Optional tool counts differ and are measured. Token usage reported when provided; no claim of matched token usage. All six designs declared before runs; no heldout selection."
  },
  "evaluation": {
    "evaluator_version": "frontdoor-eval-v1",
    "primary_metrics": [
      "completed",
      "recorded_replay_exact",
      "temporal_and_label_boundary",
      "urgency_floor_preserved"
    ],
    "secondary_metrics": [
      "tool_calls",
      "model_calls",
      "latency_ms",
      "graph_variants"
    ],
    "statistics_plan": "Descriptive synthetic software invariants only; 20 patients, two timepoints each. No clinical thresholds or statistical superiority claims.",
    "exclusion_rules": [
      "No case may be excluded after its result is seen"
    ],
    "final_test_access": "sealed"
  },
  "stop_rules": [
    "Stop external run at configured budget; preserve failures. Invalidate readiness if temporal or safety floor checks fail."
  ],
  "artifacts": {
    "root": "artifacts/medx",
    "logs": "artifacts/medx/benchmark.log",
    "checkpoints": "artifacts/medx/no-checkpoints",
    "predictions": "artifacts/medx/workflow-comparison.json",
    "evaluation_record": "artifacts/medx/workflow-comparison.json",
    "retention": "Retain with the Proposal Report evidence"
  },
  "approvals": {
    "required": false,
    "approval_ids": []
  },
  "risks": [],
  "result": null
}
